{
  "id": "ord_0a1b2c3d",
  "customer": {"email": "ana@example.com", "name": "Ana Lima", "vip": true},
  "items": [
    {"sku": "TEA-0042", "qty": 2, "price": 4.5},
    {"sku": "MUG-1001", "qty": 1, "price": 12.25, "discount": 0.1}
  ],
  "currency": "EUR",
  "shipping": {"country": "PT", "line1": "Rua Augusta 10", "postcode": "1100-053"},
  "notes": null
}
